{
  "stage": "4_prototype",
  "schema_version": "1.0.0",
  "run_id": "benchmark_creativity_support",
  "branch_id": "b",
  "title": "Wizard-of-Oz Evaluative Study: Meter-Aware Line-Ending Co-Writer for Formalist Verse",
  "actors": [
    {
      "role": "participant",
      "description": "A working poet with demonstrated experience writing in fixed metrical forms (sonnet, villanelle, or ballad), recruited via poetry MFA programs and formal poetry journals; each participant completes all three drafting conditions in counterbalanced order.",
      "count": 9
    },
    {
      "role": "wizard",
      "description": "A researcher trained in prosody and scansion who monitors the participant's drafting interface from a separate room and, within 4 seconds of a participant completing a line stem, manually constructs and injects three candidate line endings that (a) scan correctly to the pre-declared meter, (b) supply the required rhyme-scheme phoneme, and (c) vary in diction register from plain to elevated.",
      "count": 1
    },
    {
      "role": "observer",
      "description": "A silent second researcher who sits off to the side of the participant, logs timestamps of all wizard-panel keystrokes against the screen recording timeline, and flags any wizard response latency exceeding 8 seconds for post-hoc exclusion review.",
      "count": 1
    },
    {
      "role": "facilitator",
      "description": "The researcher who greets the participant, reads the standardized briefing script, administers condition transitions, conducts the post-session interview, and debriefs participants about the Wizard-of-Oz setup after all three conditions are complete.",
      "count": 1
    }
  ],
  "context": {
    "setting": "A quiet single-occupancy room at a university writing center; participant sits at a desk facing a 27-inch monitor. The wizard and observer occupy an adjacent room separated by a one-way mirror and a closed audio channel; the wizard's control panel runs on a second laptop not visible to the participant. No other personnel or distractions are present in the participant room.",
    "device": "Participant: desktop browser, Chrome 130, 1440×900 resolution, standard keyboard and mouse, no autocomplete or spellcheck active. Wizard: 13-inch laptop running a custom HTML/JS control panel (see materials) connected to the participant interface via a shared local WebSocket server on the lab LAN.",
    "duration_minutes": 120,
    "session_structure": "0–10 min: Facilitator reads standardized briefing script; participant signs consent form and completes a 5-item prosody screening quiz to confirm metrical competence. 10–15 min: Facilitator demonstrates the drafting interface using a neutral warm-up prompt (write two lines of iambic pentameter about weather) in whichever condition is first in the participant's counterbalanced order; wizard provides one practice round of suggestions but participant is told this is a system test. 15–55 min: Participant drafts a 14-line Shakespearean sonnet under Condition 1 (co-writer, solo, or rhyming-dictionary, per Latin-square assignment); facilitator gives a 2-min verbal prompt and leaves the room; participant works silently; wizard operates behind the curtain. 55–60 min: Participant completes the 6-item post-condition questionnaire (Likert + one open-ended). 60–100 min: Condition 2 sonnet drafted and rated under the same protocol, with a 5-minute blank-screen break between conditions. 100–110 min: Condition 3 sonnet drafted and rated. 110–120 min: Semi-structured post-session interview (5 fixed questions) and full WoZ debrief."
  },
  "task_flow": [
    {
      "step": 1,
      "participant_action": "Participant reads the printed prompt card specifying the sonnet's required meter (iambic pentameter, ABAB CDCD EFEF GG rhyme scheme) and theme constraint (the theme is 'threshold'—a moment of crossing or transition). Participant types the first 3–5 words of line 1 into the drafting interface, stopping before the line is complete, then presses Tab to signal they are ready for suggestions.",
      "system_response": "The interface displays a spinner icon labeled 'thinking…' for 1–4 seconds (duration randomized per trial to mask wizard latency), then presents three numbered candidate line endings in a panel to the right of the draft area. Each candidate is displayed in a fixed-width font with stress marks pre-annotated (e.g., 'u / u / u / u / u /') beneath the text to make metrical compliance visible. A 'Use this' button appears beside each candidate; a free-text override box is always visible at the bottom of the panel.",
      "wizard_decisions": [
        "Decide whether the participant's line stem already locks in a specific metrical pattern that restricts feasible completions (e.g., if the stem already has 7 syllables, the wizard must supply only 3-syllable completions that complete the iambic foot).",
        "Decide the diction register of each of the three candidates: candidate 1 must use plain Anglo-Saxon vocabulary, candidate 2 must use Latinate or elevated vocabulary, candidate 3 must be semantically unexpected but metrically valid—wizard judges what 'unexpected' means given the participant's established imagery so far.",
        "Decide whether any candidate would create an unresolvable rhyme debt in a later quatrain (i.e., if accepted, would make the required rhyme phoneme for a paired line extremely rare in English); if so, substitute a less rhyme-constraining alternative.",
        "Decide response latency simulation: wizard dispatches the payload within 4 seconds of the Tab keypress but the interface holds the spinner for a randomized 1–4 second overlay to normalize apparent response time across all trials."
      ]
    },
    {
      "step": 2,
      "participant_action": "Participant reads all three candidate endings, then either (a) clicks 'Use this' to accept a candidate verbatim, (b) clicks 'Use this' then edits the accepted text in-place before moving on, or (c) ignores all candidates and types a self-generated ending into the main draft area. Participant then types the stem of the next line and presses Tab again. This accept/edit/override cycle repeats for all 14 lines.",
      "system_response": "On accept: the chosen candidate text is inserted into the draft area at the cursor; the panel clears and resets. On edit: the accepted text appears in the draft area in an editable state with a yellow highlight; when the participant clicks away or presses Enter, the highlight clears and the panel resets. On override: the panel remains visible for 5 seconds with candidates grayed out, then collapses automatically. The log records the action type (accept/edit/override), the candidate index if applicable, and the timestamp for each line.",
      "wizard_decisions": [
        "When a participant edits an accepted candidate, the wizard watches the screen recording feed in real time and decides whether the edit changes the metrical pattern of the line; if the edit breaks meter, the wizard queues a non-intrusive red underline annotation (via the 'flag_meter_break' control) to appear on the next Tab press rather than interrupting mid-edit.",
        "Decide whether an override by the participant implies a semantic direction shift (e.g., participant chose a darker image than any candidate offered) that should recalibrate the register of future candidates; wizard maintains a running note on the participant's apparent lexical/tonal preferences and adjusts subsequent candidate generation accordingly.",
        "Decide whether the participant's override completion itself scans correctly; if it does not, wizard notes this in the observer log but does NOT flag it to the participant, because the study measures output quality, not in-session coaching."
      ]
    },
    {
      "step": 3,
      "participant_action": "Participant completes all 14 lines and clicks the 'Submit Draft' button. The interface displays the full sonnet in a clean read-only view and asks the participant to read it once silently before completing the post-condition questionnaire.",
      "system_response": "The interface locks the draft area, saves the full poem text and all log events to a local JSON file named by participant ID, condition, and timestamp (e.g., P03_cond1_cowriter_20250110T143022.json), and displays the read-only poem view with a 'Continue to questions' button that becomes active after 30 seconds (enforcing the silent read).",
      "wizard_decisions": [
        "Decide whether to flag this session's poem for post-hoc prosody audit: if the wizard observed 3 or more uncorrected metrical breaks during the session (tracked in the observer log), the wizard marks the JSON file with a 'prosody_audit_required' field set to true, which will trigger an independent scansion check before the poem is submitted to blind raters.",
        "Decide whether any wizard error occurred during the session (e.g., a candidate was dispatched with the wrong rhyme phoneme) that would require annotating the session log with a 'wizard_error' flag and notifying the PI before the poem is included in the blind rating pool."
      ]
    },
    {
      "step": 4,
      "participant_action": "Participant completes the 6-item post-condition questionnaire on a separate paper form: items 1–5 are 7-point Likert scales (agency, fluency, satisfaction, perceived quality, tool intrusiveness); item 6 is an open-ended question ('Describe in 2–4 sentences what it felt like to write this poem'). Participant then takes a 5-minute eyes-closed break before the facilitator re-enters to begin the next condition.",